{
  "version": "0",
  "id": "f71bbbbb-5b36-40c2-f7dc-804ca6270cd6",
  "detail-type": "WorkflowRunUpdate",
  "source": "orcabus.workflowmanager",
  "account": "123456789012",
  "time": "2024-05-01T09:25:44Z",
  "region": "ap-southeast-2",
  "resources": [],
  "detail": {
    "portalRunId": "202405012397gatc",
    "workflowRunName": "TestWorkflowRunNo1",
    "workflow": {
      "orcabusId": "wfl.01J5M2JFE1JPYV62RYQEG99CPW"
    },
    "libraries": [
      {
        "libraryId": "L000001",
        "orcabusId": "lib.01J5M2J44HFJ9424G7074NKTGN"
      },
      {
        "libraryId": "L000002",
        "orcabusId": "lib.01J5M2JFE1JPYV62RYQEG99CP5"
      }
    ],
    "status": "DRAFT",
    "payload": {
      "version": "0.1.0",
      "data": {
        "projectId": "axxxxxxxx-axxx-1xxxx-aaaa-xxxxxxxxx",
        "executionId": "12345678-238c-4200-b632-d5dd8c8db94a",
        "outputUriPrefix": "icav2://12345678-32d3-4c76-a324-c6a85dae87b5/ilmn_primary/"
      }
    }
  }
}
