{
  "version": "0",
  "id": "f71bbbbb-5b36-40c2-f7dc-804ca6270cd6",
  "detail-type": "WorkflowRunUpdate",
  "source": "orcabus.workflowmanager",
  "account": "123456789012",
  "time": "2024-05-01T09:25:44Z",
  "region": "ap-southeast-2",
  "resources": [],
  "detail": {
    "id": "9a4a56898f96a74c28557df54e760275",
    "version": "1.0.0",
    "timestamp": "2025-05-01T09:25:44Z",
    "orcabusId": "wfr.01J5M2J44HFJ9424G7074HHHHH",
    "portalRunId": "202405012397gatc",
    "executionId": "e4a91a1c-3c2a-4e7e-9b3e-1234567890ab",
    "workflowRunName": "540424_A01001_0193_BBBBMMDRX5 FASTQ Copy",
    "workflow": {
      "orcabusId": "wfl.01J5M2JFE1JPYV62RYQEG99CPW",
      "name": "bssh_icav2_fastq_copy",
      "version": "1.2.3",
      "codeVersion": "0.0.0",
      "executionEngine": "ICA",
      "executionEnginePipelineId": "123.456.789",
      "validationState": "UNVALIDATED"
    },
    "analysisRun": {
      "orcabusId": "anr.01J5M2JFE1JPYV62RYQEG99RUN",
      "name": "wgts-dna"
    },
    "libraries": [
      {
        "libraryId": "L000001",
        "orcabusId": "lib.01J5M2J44HFJ9424G7074NKTGN",
        "readsets": [
          {
            "orcabusId": "fqr.READSET123456789ABCDEFGHJK",
            "rgid": "AAGCAGTC+ACGCCAAC.1.990101_A00130_0999_BH7TVMDSX7"
          },
          {
            "orcabusId": "fqr.READSET234567891ABCDEFGHJK",
            "rgid": "AAGCAGTC+ACGCCAAC.2.990101_A00130_0999_BH7TVMDSX7"
          }
        ]
      },
      {
        "libraryId": "L000002",
        "orcabusId": "lib.01J5M2JFE1JPYV62RYQEG99CP5",
        "readsets": [
          {
            "orcabusId": "fqr.READSET345678912ABCDEFGHJK",
            "rgid": "CCGCAGTC+TCGCCAAC.1.990101_A00130_0999_BH7TVMDSX7"
          },
          {
            "orcabusId": "fqr.READSET456789123ABCDEFGHJK",
            "rgid": "CCGCAGTC+TCGCCAAC.2.990101_A00130_0999_BH7TVMDSX7"
          }
        ]
      }
    ],
    "computeEnv": "clinical",
    "storageEnv": "clinical",
    "status": "READY",
    "payload": {
      "refId": "af7401ac30b18164fafd3f7357726469c6401bef78549375c0b56d3a42bab0d1",
      "version": "0.1.0",
      "data": {
        "projectId": "bxxxxxxxx-dxxx-4xxxx-adcc-xxxxxxxxx",
        "executionId": "12345678-238c-4200-b632-d5dd8c8db94a",
        "outputUriPrefix": "icav2://12345678-32d3-4c76-a324-c6a85dae87b5/ilmn_primary/"
      }
    }
  }
}
